{
  "version": 1,
  "destination": "韓國首爾",
  "dates": {"start": "2026-10-17", "end": "2026-10-21", "nights": 4, "season": "秋"},
  "arrival":   {"date": "2026-10-17", "time": "05:00", "airport": "ICN", "terminal": "T2", "carrier": "真航空（Jin Air）"},
  "departure": {"date": "2026-10-21", "time": "16:10", "airport": "ICN", "terminal": "T2", "carrier": "大韓航空"},
  "origin":    {"airport": "TPE", "terminal": "T1"},
  "stay":      {"area": "中區光化門／市廳一帶", "nearest_station": "光化門站（5號線）／市廳站（1、2號線）", "checkin": "15:00"},
  "party":     {"adults": 4, "children": 0, "rooms": 1, "mobility_notes": null},
  "style":     {"pace": null, "interests": ["古宮韓屋", "傳統市場美食", "河濱夜景", "文青咖啡商圈", "包車近郊一日遊"]},
  "named_musts": [
    "景福宮",
    "北村韓屋村",
    "益善洞韓屋村",
    "東大門歷史文化公園",
    "明洞商圈",
    "倫敦貝果博物館 安國店",
    "鷺梁津水產市場",
    "汝矣島漢江公園",
    "THE HYUNDAI SEOUL（現代百貨）",
    "63大廈",
    "南怡島／小法國村／鐵路自行車（包車一日遊）",
    "首爾林",
    "聖水洞咖啡街",
    "소문난성수감자탕（祖傳三代馬鈴薯排骨湯）",
    "德壽宮",
    "首爾觀光巴士夜遊（光化門站發車）"
  ],
  "named_undecided": [
    "星空圖書館（THE HYUNDAI SEOUL 二選一備案）",
    "N首爾塔／南山塔（草稿備註另列，未排入主行程）",
    "弘大（草稿備註另列，未排入主行程）"
  ],
  "derived_constraints": [
    "Day1 05:00 抵達為紅眼班機（台北 01:25 起飛）：可用時數長但體力低，且飯店 15:00 才能入住，需安排行李寄放與低強度上午行程",
    "Day5 16:10 起飛：回推機場報到與接送時間，飯店 10:30 集合出發，末半天實際可用時間極短，不宜安排新景點",
    "南怡島／小法國村／鐵路自行車屬包車一日遊，須事先預約，行程需整段保留",
    "首爾觀光巴士夜遊需於 18:00 前抵達光化門站集合，且草稿註明「選右邊位置」，屬已預約項目，時段不可任意挪動",
    "Day1、Day5 均為「已預約機場接送」，接送時段需與班機時刻對齊，不宜另排市區行程占用緩衝",
    "草稿未明講同行者有飲食限制，不主動臆測套用，選材維持熱門度導向"
  ],
  "inferred_fields": ["stay.area", "stay.nearest_station", "stay.checkin"],
  "provenance": "private/input/行程.md（使用者提供，不進版控）"
}
