{
  "version": 1,
  "destination": "韓國首爾",
  "dates": {"start": "2026-10-17", "end": "2026-10-21", "nights": 4, "season": "秋"},
  "arrival":   {"date": "2026-10-17", "time": "05:00", "airport": "ICN", "terminal": "T2", "carrier": "真航空（Jin Air）"},
  "departure": {"date": "2026-10-21", "time": "16:10", "airport": "ICN", "terminal": "T2", "carrier": "大韓航空"},
  "origin":    {"airport": "TPE", "terminal": "T1"},
  "stay":      {"area": "市廳／光化門商圈一帶（中區）", "nearest_station": "光化門站（5號線）／市廳站（1、2號線）", "checkin": "15:00"},
  "party":     {"adults": 4, "children": 0, "rooms": 1, "mobility_notes": null},
  "style":     {"pace": null, "interests": ["美食", "咖啡廳", "傳統市場", "歷史古蹟／韓屋", "夜景", "換匯比價"]},
  "named_musts": [
    "景福宮",
    "北村韓屋村",
    "益善洞韓屋村",
    "東大門歷史文化公園",
    "明洞（逛街／晚餐／王妃家）",
    "南怡島",
    "小法國村",
    "鐵路自行車（包車一日遊）",
    "鷺梁津水產市場",
    "汝矣島漢江公園",
    "THE HYUNDAI SEOUL（現代百貨）",
    "63大廈（看夜景）",
    "首爾林",
    "소문난성수감자탕（祖傳三代馬鈴薯排骨湯）",
    "聖水洞咖啡街",
    "首爾觀光巴士夜遊路線（光化門站）",
    "德壽宮",
    "倫敦貝果博物館 安國店",
    "三清洞",
    "換匯（市政廳換錢所／大使館換錢所／一品香換錢所）",
    "首爾塔",
    "弘大"
  ],
  "named_undecided": [
    "星空圖書館（與 THE HYUNDAI SEOUL 二擇一）",
    "Day2 早餐地點（星巴克／超商）",
    "Day3 早餐地點（附近咖啡廳／便利商店）",
    "Day4 早餐地點（onion 聖水洞）",
    "機場貴賓室使用時機（通關前或後，使用者原稿自己也標註問號）"
  ],
  "derived_constraints": [
    "Day1（10/17）05:00 抵達 ICN 屬紅眼班機時段，已預約機場接送；飯店 15:00 才能入住，當日上午需安排行李寄放，全天緊接景福宮／北村／益善洞／東大門／明洞等高強度行程，需注意長輩與整體體力分配。",
    "Day5（10/21）16:10 起飛，草稿寫 10:30 飯店大廳集合前往機場；回推國際線報到與安檢時間，實際市區可用時間極短，僅安排德壽宮＋機場貴賓室，行程安排需嚴格控制在 10:30 前結束。",
    "Day3（10/19）南怡島／小法國村／鐵路自行車為一日包車行程，草稿列 8:30 飯店大廳集合、18:30 於明洞（王妃家）結束，屬於需事先預約、時段固定的骨架行程，其餘天數安排需避開與此衝突。",
    "Day4（10/20）草稿要求 18:00 前抵達光化門站搭乘首爾觀光巴士夜遊路線（建議坐右側座位），屬預約定時行程，當日白天（首爾林／소문난성수감자탕／聖水洞咖啡街）需在 18:00 前完成並移動至光化門。",
    "換匯地點使用者列了三個候選（市政廳換錢所／大使館換錢所／一品香換錢所）尚未決定，屬 named_undecided，06 支付主題需列出三者比較供參考。",
    "機場貴賓室使用時機（通關前／後）使用者原稿自己標註問號，02 通關主題需一併確認流程並回填。",
    "同行為 4 位成人（無兒童欄位），非親子帶小孩旅遊，可能含長輩同行，行程節奏與友善度評分依一般成人家庭旅遊處理，不做兒童特殊加權。"
  ],
  "inferred_fields": ["stay.area", "stay.nearest_station", "stay.checkin", "party.rooms", "style.interests"],
  "provenance": "trips/2026-10-seoul-family/private/input/行程_原始.md（使用者提供，不進版控）"
}
