{
  "version": 1,
  "destination": "韓國首爾",
  "dates": {"start": "2026-10-17", "end": "2026-10-21", "nights": 4, "season": "秋"},
  "arrival":   {"date": "2026-10-17", "time": "05:00", "airport": "ICN", "terminal": "T2", "carrier": "真航空（Jin Air）"},
  "departure": {"date": "2026-10-21", "time": "16:10", "airport": "ICN", "terminal": "T2", "carrier": "大韓航空"},
  "origin":    {"airport": "TPE", "terminal": "T1"},
  "stay":      {"area": "中區光化門／市廳一帶", "nearest_station": "光化門站（5號線）／市廳站（1、2號線）", "checkin": "15:00"},
  "party":     {"adults": 4, "children": 0, "rooms": 1, "mobility_notes": null},
  "style":     {"pace": null, "interests": ["古宮韓屋", "傳統市場美食", "河濱夜景", "文青咖啡商圈", "包車近郊一日遊"]},
  "named_musts": [
    "景福宮",
    "北村韓屋村",
    "益善洞韓屋村",
    "東大門歷史文化公園",
    "明洞商圈",
    "倫敦貝果博物館 安國店",
    "鷺梁津水產市場",
    "汝矣島漢江公園",
    "THE HYUNDAI SEOUL（現代百貨）",
    "63大廈",
    "南怡島／小法國村／鐵路自行車（包車一日遊）",
    "首爾林",
    "聖水洞咖啡街",
    "소문난성수감자탕（祖傳三代馬鈴薯排骨湯）",
    "德壽宮",
    "首爾觀光巴士夜遊（光化門站發車，選右邊位置）",
    "N 首爾塔（觀光巴士行經停靠站，可停留參觀約20分鐘，見草稿最上方「觀光巴士資訊」段落，非「# old」區塊內容）"
  ],
  "named_undecided": [],
  "derived_constraints": [
    "Day1 05:00 抵達為紅眼班機（台北 01:25 起飛）：可用時數長但體力低，且飯店 15:00 才能入住，需安排行李寄放與低強度上午行程",
    "Day5 16:10 起飛：回推機場報到與接送時間，飯店 10:30 集合出發，末半天實際可用時間極短，不宜安排新景點",
    "南怡島／小法國村／鐵路自行車屬包車一日遊，須事先預約，行程需整段保留",
    "首爾觀光巴士夜遊需於 18:00 前抵達光化門站集合，且草稿註明「選右邊位置」，屬已預約項目，時段不可任意挪動",
    "Day1、Day5 均為「已預約機場接送」，接送時段需與班機時刻對齊，不宜另排市區行程占用緩衝",
    "草稿未明講同行者有飲食限制，不主動臆測套用，選材維持熱門度導向",
    "草稿內每日早餐欄位多處標示問號（如「星巴克/超商?」「附近咖啡廳?便利商店?」「機場貴賓室(查在海關前?後?)」），屬使用者尚未確認的執行細節而非候選景點，不列入 named_undecided，改記於此提醒下游主題留意"
  ],
  "inferred_fields": ["stay.area", "stay.nearest_station", "stay.checkin"],
  "provenance": "private/input/行程.md（使用者提供，不進版控）。草稿內含兩版行程：一份為「行程規劃表」格式的表格版（無新舊標記，但位於檔案較前段、內容較完整且已把舊版的二選一項目定案），另一份標題明確寫「# old」的條列版（含「星空圖書館 or THE HYUNDAI SEOUL」的未定案寫法，以及末尾備註「首爾塔／弘大」）。依 references/intake.md 新舊版判斷規則第 1 條（有明確新舊標記時採未被標記的版本，舊版整份排除、不抽任何欄位），本檔採用表格版，「# old」區塊全部未採用；因此「星空圖書館」「弘大」不出現在任何欄位。表格版之外，檔案最上方「觀光巴士資訊」段落（含 N 首爾塔的停靠說明）屬當前有效資訊，非 old 區塊內容，予以保留。"
}
